{
  "scenario_version": "review-scenario-v0.1",
  "scenario_id": "intentional-backlog",
  "title": "Intentional backlog has bounded extra context",
  "category": "abuse",
  "rule_version": "review-v0.1",
  "description": "Intentional backlog has bounded extra context",
  "tags": [
    "abuse",
    "matched-control"
  ],
  "days": [
    {
      "anki_day": "2026-01-05",
      "sessions": [
        {
          "session_id": "late",
          "episodes": [
            {
              "source_event_key": "intentional-backlog",
              "card_lineage": "backlog-card",
              "anki_day": "2026-01-05",
              "outcome": "good",
              "due_relation": "overdue",
              "memory": {
                "confidence": "high",
                "retrievability_actual": 0.1,
                "retrievability_natural_due": 0.9,
                "stability_before": 1.0,
                "stability_good_counterfactual": 1.5168967963882134
              }
            }
          ]
        }
      ]
    }
  ],
  "assertions": [
    {
      "type": "ratio_to_control_lte",
      "scope": "comparison",
      "metric": "total_review_units",
      "expected": 1.03
    },
    {
      "type": "approximately_equals",
      "scope": "scenario",
      "metric": "total_review_units",
      "expected": 1.025
    }
  ],
  "control_scenario_id": "timely-backlog-control",
  "comparison_basis": "documented-difference",
  "comparison_note": "The tested factor is lower actual retrievability after intentional delay; natural-due memory state and card opportunity remain matched."
}
